image_path,species_name,species_description
static/imagenes/tucan.jpg,Tucán,Un ave colorida con un gran pico, nativa de las selvas tropicales.
static/imagenes/jaguar.jpeg,Jaguar,Un felino grande y poderoso que habita en América Latina.
static/imagenes/tapir.jpeg,Tapir,Un mamífero grande y herbívoro que se encuentra en las selvas tropicales.
static/imagenes/mango.jpeg,Mango,Un fruto tropical dulce y jugoso, muy popular en América Latina.
static/imagenes/cafe.jpeg,Café,Granos que se utilizan para hacer una bebida estimulante conocida mundialmente.
static/imagenes/guayaba.jpeg,Guayaba,Una fruta tropical rica en vitamina C, con un sabor dulce y ácido.
